company,job-title,level,description
NXT LABS,Data Analyst,Mid-Senior level,"Seniority level: Mid/SenExperience in years: 3-4 years of exp.Manadatory technologies: Must to have exerience as Data anlalyst / process and automationengineers for contextualization of manufacturing PI sensor Data,Must to have exerience as Data analyst experience in software who can understand thetechnical side of production, still knowledge or observations in technical side of theproduction is desirableWe are looking for someone familiar with manufacturing to collect, analyze data and doreporting. Like process and automation engineers can be our starting point.We need hiring someone familiar with pharma manufacturing to collect, analyze data andmake reports, work with data. Surelythe person must have knowledge of Excel and GoogleSheet.REQUIREMENTS:○ It certainly needs to be a technical person who can understand the technical side ofproduction, I am talking like the equipment and the sensors to it. On the other hand ithas to be a data analyst who collects requirements and makes reports.○ Probably a process and automation engineers who have worked in a pharmamanufacturing might fit the requirementsThe role:○ We are currently looking for someone who can support with the contextualization ofmanufacturing PI sensor Data, these are the skills we would need:○ Process knowledge of drug substance (upstream and downstream process)○ Most be familiar with the equipment in the plant (bioreactors, centrifuges,chromatography skids, viral filters, UF/DF, media and buffer tanks, among others).○ High level understanding of recipes and general knowledge of the batch genealogyPowered by JazzHRDp6KEC8tzb"
Unilever,Aspire for Unilever - AM Process,Entry level,"Explore Opportunities with Unilever's Aspire Platform: AM Process Disclaimer: Kindly note this role is not actively open and applying allows you to share your resume, expressing your interest in working with Unilever. We will review your profile from our resume bank when a suitable opportunity arises and reach out if alignedCalling all Process Engineers! Join our talent pool for ""AM Process"" roles at Unilever. If you have 2+ years of experience, share your profile to express your interest in prospective positions. We'll be in touch if your profile aligns with upcoming opportunities. Contribute your expertise in planning shop floor operations, monitoring consumption, and labor management for efficient manufacturing. Ensure partnerships with R&D on innovation plant trials, optimize equipment, and implementation of best practices & all audit recommendations. Ready to drive industrial excellence? Apply Now!Kindly note this role might not necessarily be actively open and applying allows you to share your resume, expressing your interest in working with Unilever. A talent pool may be created from this recruitment action for ongoing and temporary roles of the same work classification that may become available for filling over the next 12 months.Unilever is an organisation committed to equity, inclusion and diversity to drive our business results and create a better future, every day, for our diverse employees, global consumers, partners, and communities. We believe a diverse workforce allows us to match our growth ambitions and drive inclusion across the business. At Unilever we are interested in every individual bringing their ‘Whole Self’ to work and this includes you! Thus if you require any support or access requirements, we encourage you to advise us at the time of your application so that we can support you through your recruitment journey."
Dastgyr,Data Scientist,Entry level,"About DastgyrDastgyr is on a mission to simplify the inefficient retail supply chain by connecting retailers with suppliers via technology. It is empowering the often non-serviced areas of the retail landscape by offering extensive inventory choices, transparent pricing, and next day doorstep delivery -- all with a few clicks from a smartphone. Dastgyr aims to positively impact the country’s economy by helping offline grocery retailers, who contribute significantly to Pakistan's GDP.Responsibilities Assist in data collection, preprocessing, and cleaning.  Support basic data analysis and visualization tasks.  Learn and apply fundamental statistical concepts.  Collaborate on small-scale machine learning tasks.  Design and implement data pipelines independently.  Develop ETL processes to transform and integrate data from multiple sources.  Optimize and fine-tune data pipelines for improved performance.  Collaborate with data scientists and analysts to provide quality data for analysis.  Manage and maintain databases, ensuring data integrity and availability.  Contribute to the adoption of cloud platforms and data warehousing solutions.  Take ownership of troubleshooting and resolving data pipeline issues."
Jeeny,Growth Analyst,Associate,"Jeeny is a mobile application that eases daily commuting and transportation. We are a joint venturebetween MEIG (Middle East Internet Group) - Rocket Internet and IMENA. We have offices in Riyadh,Jeddah, Madinah, Dammam, Khobar, Amman, Lahore and Karachi.We are a young spirited team that is always eager for growth and breaking limits. Therefore, we neverhad, nor intend on having, any day where we don’t experience achievements. If you’re looking for achallenging, fun and fulfilling environment, then Jeeny is home!Job Responsibilities: Choosing in accordance with the other departments which metrics/KPIs (Key PerformanceIndicators) to focus on for supply and demand. Bringing traditional, creative and new ideas how to grow those KPIs A/B testing implementation for continuous improvements Analyzing the data and passengers and drivers' behavior & feedback Exchanging ideas/data/feedback with other departments (Product, marketing, topmanagement) in order to present results and make the product more Passenger/Driver-centric. Understanding conversion rate optimization (CRO) principles and hacks and being able to applyCRO hacks to any businesses.- Working with the AARRR Metrics Diagram (Acquisition – Activation – Retention – Referral -Revenue) Prioritizing internal and 3rd party growth channels Optimizing channels in order to always improve the performance of ones business Scaling and Automating the growth processes Knowledgeable about referral marketing and being able to create viral growth by harnessingcreative communications, marketplace discounts and technology.RequirementsRequirements: Being data-driven and kind of a data-geek: clear understanding of data, analytics, metrics andstatistics. Being social and understanding users’ behavior. Having great customer relations skills and beingfocus on customer experience. Willing to learn A/B Testing and Data Analytics experience Courage to pivot processes with agility Knowledge about both inbound and outbound marketing Being performance and results-oriented Being curious and creative Being relentless in pursuit of growthBenefitsMarket competitive salary An opportunity to collaborate with talented individuals while learning, growing, and expanding your skill setAn environment that encourages you to take ownership and produce excellent outcomes everydayHealth benefits and life insuranceContinuously broaden your knowledge and skills with our learning assistance policyGratuity Company Culturejeeny is an equal opportunity employer. We are committed to providing a workplace where all aspects of employment are solely based on merit. We value diversity and absolutely do not discriminate in any form based on race, color, ethnicity, nationality, religion, gender, age, or mental or physical disability."
Fleek (YC W22),Data Analyst,Entry level,"We are seeking highly analytical, driven and intellectually curious Data Analysts to join our team and help enable data-driven problem solving. You will be responsible for evaluating performance metrics, diagnosing problems and leading execution of data-driven solutions.Collect, analyze, and interpret data from various sourcesUse statistical techniques to analyze trends, identify opportunities for optimization, and generate insightsCreate visualizations and reports to effectively convey findings to the team and stakeholdersWork with cross-functional teams to identify business requirements and translate them into data-driven solutionsDevelop and maintain dashboards, reports, and presentations to support business decisionsBuild a knowledge base by authoring playbooks and documentation for end-to-end solution and integrations in the overall architectureRequirementsProficiency in data analysis tools and softwares such as SQLKnowledge of programming languages such as Python or R is preferredExceptional analytical, quantitative, problem solving, and critical thinking skillsAbility to work independently as well as in a collaborative environmentHaving experience working at a startup is preferred. 2+ years of experience in a similar role is preferredBenefitsWe at Fleek believe in happy employees. We want it to feel like home :-)Comprehensive healthcare coverageExclusive employee clothing drops courtesy FleekFlexible work hours & time off. Shared ownership: Being On Fleek means you’ll own a part of itInternational team meetups/trips"
